Name,Price,Rating,Description,Image
Dove Shampoo,Rs. 200,4.5 stars,A gentle shampoo that leaves your hair feeling soft and smooth.,images/dove_shampoo.jpg
Dove Conditioner,Rs. 150,4.6 stars,A conditioner that nourishes and detangles your hair.,images/dove_conditioner.jpg
Nivea Bodywash,Rs. 300,4.8 stars,A refreshing body wash that cleanses and revitalizes your skin.,images/nivea_bodywash.jpg
Colgate Toothpaste,Rs. 75,4.7 stars,A toothpaste that provides complete oral care and fresh breath.,images/colgate_toothpaste.jpeg
Dettol Hand Sanitizer,Rs. 50,4.9 stars,An instant hand sanitizer that kills 99.9% of germs without water.,images/dettol_sanitizer.jpeg
Vaseline Body Lotion,Rs. 180,4.6 stars,A body lotion that moisturizes and heals dry skin.,images/vaseline_lotion.jpg
